{
  "name": "time-series-forecast-packager",
  "type": "cli",
  "path": "outputs/time_series_forecast_packager.py",
  "description": "Builds an integrated time-series forecast package from phase 14 evidence: upstream reports, leaderboard, prediction intervals, anomaly triage flags, decision report, quality gate summary and checksum manifest.",
  "usage": "python outputs/time_series_forecast_packager.py --spec ../data/tiny/forecast_package_spec.json --scenario ../data/tiny/forecast_scenario.json --metric-observations ../data/tiny/metric_observations.csv --calendar ../data/tiny/calendar.csv --data-revisions ../data/tiny/data_revisions.csv --metric-leaderboard ../10-forecast-metrics/outputs/metric_leaderboard.csv --interval-forecasts ../11-prediction-intervals/outputs/interval_forecasts.csv --interval-coverage ../11-prediction-intervals/outputs/interval_coverage.csv --time-index-report ../01-time-index/outputs/time_index_audit.json --resampling-report ../02-resampling/outputs/resampling_report.json --window-feature-report ../03-rolling/outputs/window_feature_report.json --seasonality-report ../04-trend-and-seasonality/outputs/seasonality_report.json --temporal-leakage-report ../05-temporal-leakage/outputs/temporal_leakage_report.json --baseline-report ../06-forecast-baselines/outputs/baseline_report.json --model-report ../08-ets-and-arima/outputs/model_report.json --backtest-report ../09-backtesting/outputs/backtest_report.json --metric-report ../10-forecast-metrics/outputs/metric_report.json --interval-report ../11-prediction-intervals/outputs/interval_report.json --output-dir outputs"
}
