{
  "name": "order-time-model",
  "type": "sql",
  "path": "outputs/order_time_model.sql",
  "description": "Сохраняет grain заказов, различает корректные, пропущенные и поврежденные строки времени и строит типизированные момент, локальное время, бизнес-день и бизнес-месяц в явно заданной timezone.",
  "usage": "Создать в DuckDB таблицу orders_source(order_id VARCHAR, ordered_at VARCHAR), при необходимости изменить business_timezone в CTE settings и выполнить outputs/order_time_model.sql; outputs/temporal_semantics_experiment.sql отдельно показывает различие длительности и календарного шага."
}
