{
  "name": "pandas-line-item-features",
  "type": "function",
  "path": "outputs/order_transforms.py",
  "description": "Добавляет к уже типизированной таблице товарных позиций проверяемые производные столбцы, сохраняя grain, индекс и неизвестные значения.",
  "usage": "uv run --locked python code/main.py"
}
