{
  "name": "streamlit-cache-state-auditor",
  "type": "cli",
  "path": "outputs/streamlit_cache_state_auditor.py",
  "description": "Собирает cache/state/freshness слой поверх проверенного Streamlit app bundle: st.cache_data для данных, st.cache_resource для figure payload, session_state для per-session UI, TTL/max_entries policy, checksum invalidation, freshness report, stale warnings и cache_state audit.",
  "usage": "python phases/17-delivery/07-caching-and-state/outputs/streamlit_cache_state_auditor.py --write-example /tmp/cache-state-example --output-dir /tmp/cache-state-app --fail-on-invalid"
}
