{
  "name": "prediction-interval-calibrator",
  "type": "cli",
  "path": "outputs/prediction_interval_calibrator.py",
  "description": "Calibrates residual, bootstrap and model-based prediction intervals from rolling-origin forecast errors, checks empirical coverage, writes interval forecasts, backtest interval rows, calibration audit and coverage report.",
  "usage": "python outputs/prediction_interval_calibrator.py --errors ../09-backtesting/outputs/backtest_errors.csv --final-baseline-forecasts ../06-forecast-baselines/outputs/baseline_forecasts.csv --final-candidate-forecasts ../08-ets-and-arima/outputs/candidate_forecasts.csv --backtest-report ../09-backtesting/outputs/backtest_report.json --metric-report ../10-forecast-metrics/outputs/metric_report.json --spec ../data/tiny/prediction_interval_spec.json --output-dir outputs"
}
