{
  "name": "verified-partitioned-dataset",
  "type": "cli",
  "path": "outputs/dataset_builder.py",
  "description": "Сравнивает объявленные Hive layouts, строит выбранный dataset и атомарно публикует data с checksum-manifest только после semantic и workload checks.",
  "usage": "python outputs/dataset_builder.py --input orders.parquet --contract partition_layout_contract.json --output-dir orders_dataset"
}
