{
  "name": "analytics-mart-packager",
  "type": "cli",
  "path": "outputs/analytics_mart_packager.py",
  "description": "Builds and validates the reproducible local analytics-mart-dbt release package, including dbt artifacts, quality reports, lineage summary, release report and checksum manifest.",
  "usage": "uv run --locked python phases/11-analytics-engineering/11-dbt-duckdb-project/outputs/analytics_mart_packager.py --build-package --output phases/11-analytics-engineering/11-dbt-duckdb-project/outputs/package_audit.json"
}
