{
  "name": "delivery-cli-runner",
  "type": "cli",
  "path": "outputs/delivery_cli_runner.py",
  "description": "Запускает delivery pipeline поверх cache/state-ready Streamlit app: явные input/output paths, check mode без публикации, staged publish через os.replace, publish manifest, JSON run report и exit-code policy для success, data quality block, freshness warning и system error.",
  "usage": "python phases/17-delivery/08-cli/outputs/delivery_cli_runner.py --write-example /tmp/delivery-cli-example --output-dir /tmp/delivery-cli-package"
}
