{
  "name": "dbt-incremental-model-contract",
  "type": "tool",
  "path": "outputs/incremental_model_auditor.py",
  "description": "Проверяет dbt incremental model: config, unique_key, late-arrival window, full-refresh playbook, schema change policy и live-сценарий с поздно пришедшим заказом.",
  "usage": "python outputs/incremental_model_auditor.py --project outputs/incremental_project --data-contract ../data/contract.json --run-dbt"
}
