{
  "name": "resampling-pipeline",
  "type": "cli",
  "path": "outputs/resampling_pipeline.py",
  "description": "Resamples subscription ledger events into regular daily and weekly active subscription series, normalizes timestamps to business dates, reconciles against published metric observations, and flags partial periods.",
  "usage": "python outputs/resampling_pipeline.py --events ../data/tiny/subscription_events.csv --metrics ../data/tiny/metric_observations.csv --calendar ../data/tiny/calendar.csv --scenario ../data/tiny/forecast_scenario.json --spec ../data/tiny/resampling_spec.json --output-dir outputs"
}
