{
  "name": "pandas-safe-merge",
  "type": "function",
  "path": "outputs/safe_merge.py",
  "description": "Проверяет cardinality merge, считает unmatched-ключи и присоединяет заранее агрегированные товарные позиции без размножения заказов.",
  "usage": "uv run --locked python outputs/safe_merge.py ../data/tiny/orders.csv ../data/tiny/order_items.csv"
}
