{
  "name": "pandas-segment-metrics",
  "type": "function",
  "path": "outputs/segment_metrics.py",
  "description": "Считает метрики оплаченных заказов на явно заданном grain и проверяет уникальность исходного order_id.",
  "usage": "uv run --locked python outputs/segment_metrics.py ../data/tiny/orders.csv --group-by currency"
}
