{
  "name": "dbt-project-auditor",
  "type": "tool",
  "path": "outputs/dbt_project_auditor.py",
  "description": "Audits a minimal dbt-duckdb project skeleton, profile contract, resource directories and reproducible debug/parse/compile commands.",
  "usage": "python outputs/dbt_project_auditor.py --project outputs/dbt_project_skeleton --output outputs/dbt_project_audit.json --run-dbt"
}
