{
  "name": "pandas-text-category-contract",
  "type": "function",
  "path": "outputs/text_categories.py",
  "description": "Нормализует текст, сводит синонимы и переводит значения в категориальный dtype с явной политикой неизвестных категорий.",
  "usage": "uv run --locked python outputs/text_categories.py ../data/tiny/users.csv --items ../data/tiny/order_items.csv"
}
