{
  "name": "numpy-feature-normalization",
  "type": "function",
  "path": "outputs/feature_normalization.py",
  "description": "Проверяет broadcast-совместимость форм и стандартизует столбцы матрицы признаков.",
  "usage": "uv run --locked python outputs/feature_normalization.py --matrix '[[1, 10], [3, 14], [5, 18]]'"
}
