{
  "name": "sql-mart-builder",
  "type": "cli",
  "path": "outputs/sql_mart_builder.py",
  "description": "Самостоятельный CLI с двумя SQL assets: напрямую экспортирует проверенные order и user marts, фиксирует evidence выбора инструментов и проверяет переносимый checksum-package.",
  "usage": "python outputs/sql_mart_builder.py build --users ../data/tiny/users.csv --orders ../data/tiny/orders.csv --items ../data/tiny/order_items.csv --output-dir delivery"
}
