{
  "name": "json-grain-normalizer",
  "type": "cli",
  "path": "outputs/json_normalizer.py",
  "description": "Строго разбирает JSON, проверяет envelope, пути, типы и два grain и публикует parent/child JSONL только для валидного отчета.",
  "usage": "python outputs/json_normalizer.py --input ../data/tiny/events_nested.json --contract ../data/json_contract.json --output-dir delivery"
}
