{
  "name": "numpy-array-contract",
  "type": "function",
  "path": "outputs/array_contract.py",
  "description": "Описывает ndim, shape, size и dtype массива, связывает длины с предметными именами осей и при необходимости требует числовой контракт.",
  "usage": "uv run --locked python outputs/array_contract.py"
}
