{
  "name": "excel-range-audit",
  "type": "cli",
  "path": "outputs/excel_audit.py",
  "description": "Проверяет границу фиксированного диапазона, схему, ключ, локальное время, формулы и служебное оформление Excel-книги.",
  "usage": "python outputs/excel_audit.py --input ../data/tiny/orders_report.xlsx --spec ../data/excel_spec.json"
}
