{
  "name": "event-model-validator",
  "type": "cli",
  "path": "outputs/event_model_validator.py",
  "description": "Проверяет tracking plan и событийный лог: имена, версии, обязательные свойства, identity fields, дубликаты, late arrivals, app_version для mobile и ссылки событий на metric specs.",
  "usage": "python outputs/event_model_validator.py --events ../data/tiny/events.csv --tracking-plan outputs/tracking_plan.json --metric-specs ../01-metric-tree/outputs/metric_specs.json"
}
