{
  "name": "pandas-table-inspector",
  "type": "cli",
  "path": "outputs/dataframe_inspector.py",
  "description": "Строит JSON-отчёт о форме, метках осей и целостности объявленного простого или составного бизнес-ключа DataFrame.",
  "usage": "uv run --locked python outputs/dataframe_inspector.py ../data/tiny/orders.csv --keys order_id"
}
