{
  "name": "faceted-statistical-panel",
  "type": "cli",
  "path": "outputs/seaborn_panel.py",
  "description": "Строит faceted Seaborn point estimates с явными estimator, confidence interval, seed и числовой control table.",
  "usage": "python outputs/seaborn_panel.py --input ../data/tiny/user_journeys.csv --output-dir seaborn-output"
}
