{
  "name": "peeking-audit",
  "type": "cli",
  "path": "outputs/peeking_audit.py",
  "description": "Проверяет peeking policy эксперимента: строит planned decision looks с O'Brien-Fleming/Lan-DeMets alpha spending, отделяет quality monitoring от decision peeking, симулирует false positive inflation и блокирует решение при unplanned interim looks.",
  "usage": "python outputs/peeking_audit.py --protocol ../01-hypothesis-and-metric/outputs/experiment_protocol.json --peeking-policy outputs/peeking_policy.json --power-plan ../04-mde-and-power/outputs/power_plan.json --multiple-testing-report ../08-multiple-testing/outputs/multiple_testing_report.json"
}
