{
  "name": "Проверяемый контракт агрегации по предметным осям",
  "type": "function",
  "path": "outputs/axis_aggregates.py",
  "description": "Называет свернутые и оставшиеся предметные оси, предсказывает shape и рассчитывает агрегаты с явной политикой пропусков, valid_count, ddof и dtype.",
  "usage": "uv run --locked python outputs/axis_aggregates.py --values '[[1, 2, 3], [4, 5, 6]]' --axis-names store day --axis 1"
}
